{
  "version": "1.0.0",
  "bodyTypes": {
    "humanoid": {
      "name": "Humanoid",
      "description": "Standard humanoid body type",
      "baseSprite": "sprites/bodies/humanoid/base.png",
      "variants": {
        "skinTones": [
          {
            "id": "light",
            "name": "Light",
            "colorHex": "#FFE0BD",
            "spriteModifier": "light"
          },
          {
            "id": "medium",
            "name": "Medium",
            "colorHex": "#D4A373",
            "spriteModifier": "medium"
          },
          {
            "id": "dark",
            "name": "Dark",
            "colorHex": "#8B5E3C",
            "spriteModifier": "dark"
          }
        ],
        "heights": [
          {
            "id": "short",
            "name": "Short",
            "scale": 0.8
          },
          {
            "id": "average",
            "name": "Average",
            "scale": 1.0
          },
          {
            "id": "tall",
            "name": "Tall",
            "scale": 1.2
          }
        ],
        "weights": [
          {
            "id": "slim",
            "name": "Slim",
            "spriteModifier": "slim"
          },
          {
            "id": "average",
            "name": "Average",
            "spriteModifier": "average"
          },
          {
            "id": "heavy",
            "name": "Heavy",
            "spriteModifier": "heavy"
          }
        ]
      }
    }
  },
  "layers": {
    "hair": {
      "styles": [
        {
          "id": "short",
          "name": "Short",
          "sprite": "sprites/hair/short.png"
        },
        {
          "id": "long",
          "name": "Long",
          "sprite": "sprites/hair/long.png"
        },
        {
          "id": "braided",
          "name": "Braided",
          "sprite": "sprites/hair/braided.png"
        }
      ],
      "colors": [
        {
          "id": "black",
          "name": "Black",
          "colorHex": "#1D1D1B"
        },
        {
          "id": "brown",
          "name": "Brown",
          "colorHex": "#8B4513"
        },
        {
          "id": "blonde",
          "name": "Blonde",
          "colorHex": "#FFD700"
        }
      ]
    },
    "facialFeatures": {
      "eyes": [
        {
          "id": "round",
          "name": "Round",
          "sprite": "sprites/eyes/round.png"
        },
        {
          "id": "almond",
          "name": "Almond",
          "sprite": "sprites/eyes/almond.png"
        }
      ],
      "mouths": [
        {
          "id": "neutral",
          "name": "Neutral",
          "sprite": "sprites/mouths/neutral.png"
        },
        {
          "id": "smile",
          "name": "Smile",
          "sprite": "sprites/mouths/smile.png"
        }
      ]
    },
    "clothing": {
      "torso": [
        {
          "id": "tunic",
          "name": "Tunic",
          "sprite": "sprites/clothing/torso/tunic.png",
          "type": "light"
        },
        {
          "id": "leather_armor",
          "name": "Leather Armor",
          "sprite": "sprites/clothing/torso/leather_armor.png",
          "type": "medium"
        },
        {
          "id": "plate_armor",
          "name": "Plate Armor",
          "sprite": "sprites/clothing/torso/plate_armor.png",
          "type": "heavy"
        }
      ],
      "legs": [
        {
          "id": "pants",
          "name": "Pants",
          "sprite": "sprites/clothing/legs/pants.png",
          "type": "light"
        },
        {
          "id": "leather_legs",
          "name": "Leather Leggings",
          "sprite": "sprites/clothing/legs/leather_legs.png",
          "type": "medium"
        },
        {
          "id": "plate_legs",
          "name": "Plate Leggings",
          "sprite": "sprites/clothing/legs/plate_legs.png",
          "type": "heavy"
        }
      ]
    },
    "equipment": {
      "weapons": [
        {
          "id": "sword",
          "name": "Sword",
          "sprite": "sprites/weapons/sword.png",
          "type": "melee",
          "animationSet": "sword_animations"
        },
        {
          "id": "bow",
          "name": "Bow",
          "sprite": "sprites/weapons/bow.png",
          "type": "ranged",
          "animationSet": "bow_animations"
        },
        {
          "id": "staff",
          "name": "Staff",
          "sprite": "sprites/weapons/staff.png",
          "type": "magic",
          "animationSet": "staff_animations"
        }
      ],
      "accessories": [
        {
          "id": "helmet",
          "name": "Helmet",
          "sprite": "sprites/accessories/helmet.png",
          "slot": "head"
        },
        {
          "id": "amulet",
          "name": "Amulet",
          "sprite": "sprites/accessories/amulet.png",
          "slot": "neck"
        },
        {
          "id": "cape",
          "name": "Cape",
          "sprite": "sprites/accessories/cape.png",
          "slot": "back"
        }
      ]
    }
  },
  "animations": {
    "idle": {
      "frames": 4,
      "frameDuration": 200
    },
    "walking": {
      "frames": 6,
      "frameDuration": 100
    },
    "attacking": {
      "melee": {
        "frames": 4,
        "frameDuration": 100
      },
      "ranged": {
        "frames": 4,
        "frameDuration": 150
      },
      "magic": {
        "frames": 6,
        "frameDuration": 120
      }
    },
    "spellcasting": {
      "frames": 6,
      "frameDuration": 150
    }
  }
} 